FF-SEQ;FIELD USE DESIGNATOR;ST COL;COLUMN HEADER;FLD DESC;ALT;FFIRN/FUDN;STRUCTURE;JUSTIF
1 M;FLAG;1;FLAG; ; ;1026/003;2;A;L
2 M;UNIT NAME;6;NAME OR TASK DESIG; ;A;1022/048;1-38;X;L
;NAVAL TASK DESIGNATOR;null;NAME OR TASK DESIG;NTD;B;2143/002;3-15;ANS;L
3 M;GEOGRAPHIC POSITION, LAT/LONG, DEGREES, VERIFIED;45;LOCATION; ;A;2042/001;10;ANS;L
;GEOGRAPHIC POSITION, LAT/LONG, MINUTES, VERIFIED;null;LOCATION; ;B;2043/001;14;ANS;L
;GEOGRAPHIC POSITION, LAT/LONG, SECONDS, VERIFIED;null;LOCATION; ;C;2044/001;18;ANS;L
;LOCATION NAME;null;LOCATION;LOC;D;1022/004;1-20;X;L
;PLACE NAME;null;LOCATION;PLACE;E;1022/170;1-20;X;L
