FF-SEQ;FIELD USE DESIGNATOR;FLD DESC;ALT;FFIRN/FUDN;STRUCTURE
1 M;INSPECTING STATE PARTY; ; ;1026/008;2;A
2 M;INSPECTED STATE PARTY; ; ;1026/009;2;A
3 M;CFE INSPECTION IDENTIFIER WITHOUT VARIOUS PHASE NUMBER, 4 YR; ; ;2305/001;15;AN
4 M;CFE NOTIFICATION MESSAGE NUMBER; ; ;2068/001;4-15;X
5 C;TIME PERIOD IN COUNTRY (DAYS, HOURS, MINUTES); ; ;2009/002;6;N
6 C;INSPECTION TIME PERIOD NOT CHARGEABLE N HOURS AND MINUTES; ; ;2041/002;4;N
7 C;NUMBER OF INSPECTIONS OF OBJECT OF VERIFICATION; ; ;1044/080;1-2;N
8 C;NUMBER OF INSPECTIONS WITHIN AREA; ; ;1044/081;1-2;N
