FF-SEQ;FIELD USE DESIGNATOR;FLD DESC;ALT;FFIRN/FUDN;STRUCTURE
1 M;UNIT IDENTIFICATION CODE (UIC);UIC;A;2141/001;7-9;AN
;BASE IDENTIFICATION CODE;BIC;B;2141/031;7-9;AN
;UNIT IDENTIFIER;UID;C;1028/001;1-20;X
;TASKED UNIT;TAS;D;1028/010;1-20;X
2 M;DAY-TIME AND MONTH REQUESTED START; ; ;2030/050;10;AN
3 M;NEW DEPLOYMENT LOCATION, UTM 10-METRE;UTM;A;2086/010;13;AN
;NEW DEPLOYMENT LOCATION, LAT/LONG, 1000 MINUTE, VERIFIED;LATM;B;2201/010;22;ANS
4 O;ESTIMATED DAY-TIME AND MONTH IN COMMISSION; ; ;2030/033;10;AN
