FF-SEQ;FIELD USE DESIGNATOR;FLD DESC;ALT;FFIRN/FUDN;STRUCTURE
1 M;DAY-TIME OF SUMMARY; ; ;2000/038;7;AN
2 M;MONTH NAME; ; ;1004/001;3;A
3 M;OPERATIONAL CONTROL AUTHORITY; ; ;1049/001;4;AN
4 M;NUMBER OF INDEPENDENT SHIPS IN AREA; ; ;1044/072;1-3;N
5 M;NUMBER OF INDEPENDENT SHIPS ENTERING NEXT 24 HOURS; ; ;1044/073;1-3;N
6 M;NUMBER OF INDEPENDENT SHIPS LEAVING NEXT 24 HOURS; ; ;1044/074;1-3;N
7 M;NUMBER OF CONVOYS IN AREA; ; ;1044/084;1-3;N
8 M;NUMBER OF CONVOYS ENTERING NEXT 24 HOURS; ; ;1044/085;1-3;N
9 M;NUMBER OF CONVOYS LEAVING NEXT 24 HOURS; ; ;1044/086;1-3;N
