FUDN;Name;Size;Type;Explanation;Version;Status;Modified
2;REQUIRED TOTAL;1-16;Decimal;ENTER THE TOTAL QUANTITY OF AN ITEM REQUIRED TO BE HELD ON-HAND AND IN RESERVE BY A FORMATION/UNIT TO MEET THE NATO ASSIGNED TASK IN ACCORDANCE WITH FORCE STANDARDS OR ESTABLISHED MISSION REQUIREMENTS. QUANTITIES AS DECLARED BY NATIONS IN THE DPQ REPLY, WHEN APPLICABLE, OR AS DECLARED FOR NATIONAL UNITS IN PLANS/OPERATIONS. ENTER THE CONTEXT QUANTITY (0-99999999), FOR EXAMPLE "150".;1.0;In Service;03 Dec 07
3;REQUIRED ON HAND;1-16;Decimal;ENTER THE QUANTITY OF AN ITEM REQUIRED TO BE HELD ON-HAND BY A FORMATION/UNIT (NOT INCLUDING ITEMS IN RESERVE) IN ACCORDANCE WITH FORCE STANDARDS/TASK REQUIREMENTS. ENTER THE CONTEXT QUANTITY (0-99999999), FOR EXAMPLE "110".;1.0;In Service;03 Dec 07
4;TOTAL DUE IN;1-16;Decimal;ENTER THE QUANTITY OF ITEMS EXPECTED TO BE RECEIVED BY FORMATION/UNIT BEFORE THE NEXT REPORTING PERIOD: ENTER THE CONTEXT QUANTITY (0-99999999), FOR EXAMPLE "20".;1.0;In Service;03 Dec 07
5;TOTAL DUE OUT;1-16;Decimal;ENTER THE QUANTITY OF ITEMS EXPECTED TO BE TRANSFERRED/DELIVERED OUT OF THE FORMATION/UNIT BEFORE THE NEXT REPORTING PERIOD (NOT CONSUMPTION): ENTER THE CONTEXT QUANTITY (0-99999999), FOR EXAMPLE "5".;1.0;In Service;03 Dec 07
6;ACTUAL ON HAND;1-16;Decimal;ENTER THE QUANTITY OF ITEMS PHYSICALLY HELD ON HAND BY FORMATION/UNIT (FOR NATIONAL REPLIES: ON-HAND HOLDINGS PLUS RESERVES) AS FOLLOWS: ENTER THE CONTEXT QUANTITY (0-99999999), FOR EXAMPLE "85".;1.0;In Service;03 Dec 07
10;INITIAL INVENTORY;1-4;Integer;;1.0;In Service;03 Dec 07
11;QUANTITY EXPENDED IN LAST 24 HOURS;1-4;Integer;;1.0;In Service;03 Dec 07
12;REMAINING INVENTORY;1-4;Integer;;1.0;In Service;03 Dec 07
