FF-SEQ;FIELD USE DESIGNATOR;;;CLASSNAME;NAME;FLD DESC;FFIRN;STRUCTURE;CARD;
1;CAP STATION LENGHT IN NAUTICAL MILES;;;1A;CAP STATION LENGTH IN NAUTICAL MILES;NM;1089/14;1-4;O
2;CAP DIRECTION IN DEGREES;;;2A;ANGLE IN DEGREES: TRUE, GRID, MAGNETIC, OR RELATIVE;;2065;4-4;O
3;ENEMY THREAT DIRECTION IN DEGREES OR INTERCARDINAL;;;3A;ENEMY THREAT DIRECTION IN DEGREES (T,G,M,R);DEG;2065;1-4;O
;ENEMY THREAT DIRECTION IN DEGREES OR INTERCARDINAL;;;3B;ORIENTATION, INTERCARDINAL;CP;1161/9;;
4;BULLSEYE POINT NAME;;;4A;BULLSEYE POINT NAME;;1022/31;1-38;O
