FF-SEQ;FIELD USE DESIGNATOR;;;CLASSNAME;NAME;FLD DESC;FFIRN;STRUCTURE;CARD;
1;TYPE OF PORTABLE RADIO;;;1A;EQUIPMENT TYPE;;1135/1;1-20;M
2;NUMBER OF PORTABLE RADIOS;;;2A;NUMBER OF PORTABLE RADIOS;;1044/52;1-2;M
3;BAND LIMITATIONS;;;3A;BAND LIMITATIONS;;2377;5-10;M
4;FREQUENCY SEPARATION;;;4A;FREQUENCY SEPARATION, KILOHERTZ OR MEGAHERTZ;;2385;4-14;M
5;BATTERY LIFE IN HOURS;;;5A;DURATION IN HOURS, 1-999;;1047/30;1-3;M
6;NUMBER OF SPARE BATTERIES;;;6A;NUMBER OF SPARE BATTERIES;;1044/53;1-4;M
7;PORTABLE CHARGING EQUIPMENT AVAILABLE;;;7A;AVAILABILITY OF CHARGING EQUIPMENT;;1027/82;2-3;M
