FF-SEQ;FIELD USE DESIGNATOR;;;CLASSNAME;NAME;FLD DESC;FFIRN;STRUCTURE;CARD;
1;THE COMMUNICATIONS PLAN SOURCE.;;;1A;COMM PLAN DESIGNATION;;1146/4;2-20;M
2;THE COMMUNICATIONS PLAN DESIGNATOR.;;;2A;FREQUENCY PLAN DESIGNATION;;1146/5;2-12;M
3;THE TIME OF CHANGE OVER FOR DAY TRANSMISSIONS.;;;3A;DAYTIME OF CHANGE;;2485;5-5;O
4;THE TIME OF CHANGE OVER FOR NIGHT TRANSMISSIONS.;;;4A;NIGHTTIME OF CHANGE;;2485;5-5;O
5;THE CIRCUIT LINE DESIGNATOR.;;;5A;UHF CIRCUIT LINE DESIGNATOR, PRIMARY;UHF;1305/4;3-4;O*
;THE CIRCUIT LINE DESIGNATOR.;;;5B;HF CIRCUIT LINE DESIGNATOR, PRIMARY;HF;1305/5;;
;THE CIRCUIT LINE DESIGNATOR.;;;5C;VHF CIRCUIT LINE DESIGNATOR, PRIMARY;VHF;1305/9;;
