FF-SEQ;FIELD USE DESIGNATOR;;;CLASSNAME;NAME;FLD DESC;FFIRN;STRUCTURE;CARD;
1;AREA NAME;;;1A;AREA NAME;;1022/69;1-38;M
2;GEODETIC DATUM;;;2A;GEODETIC DATUM;;1195/1;3-6;O
3;GEOGRAPHIC DEFINITION;;;3A;LATITUDE AND LONGITUDE, MINUTES, 0-4 DECIMAL PLACES;;2571;1-22;M*
;GEOGRAPHIC DEFINITION;;;3B;UNIVERSAL TRANSVERSE MERCATOR (UTM);UTM;2572;;
;GEOGRAPHIC DEFINITION;;;3C;MILITARY GRID REFERENCE SYSTEM (UTM) (MGRS-UTM);MGRS;2573;;
;GEOGRAPHIC DEFINITION;;;3D;UNIVERSAL POLAR STEREOGRAPHIC (UPS);UPS;2574;;
;GEOGRAPHIC DEFINITION;;;3E;MILITARY GRID REFERENCE SYSTEM (UPS) (MGRS-UPS);MUPS;2575;;
;GEOGRAPHIC DEFINITION;;;3F;NATIONAL GRID SYSTEM COORDINATES;GRID;1911/1;;
;GEOGRAPHIC DEFINITION;;;3G;SEGMENT PARAMETER;SEG;1527/1;;
