FF-SEQ;FIELD USE DESIGNATOR;;;CLASSNAME;NAME;FLD DESC;FFIRN;STRUCTURE;CARD;
1;MINE REFERENCE NUMBER;;;1A;MINE REFERENCE NUMBER;MRN;1012/186;4-8;M
;MINE REFERENCE NUMBER;;;1B;CONTACT PLOT DESIGNATOR;;1012/187;;
2;ARM THRUST;;;2A;SINGLE ARM THRUST RESULT CODE;;1184/2;1-2;O
;ARM THRUST;;;2B;DEPTH OF PENETRATION OF ARM THRUSTS IN CENTIMETRES;;1247/10;;
3;PERCENTAGE OF MINE BURIED;;;3A;PERCENTAGE OF MINE BURIED;;1064/20;1-3;O
4;WATER DEPTH IN METRES;;;4A;WATER DEPTH IN METRES;;1247/3;1-3;O
5;BOTTOM CURRENT IN KNOTS;;;5A;BOTTOM CURRENT IN KNOTS;;1061/12;3-3;O
6;SAND RIDGE HEIGHT IN METRES;;;6A;SAND RIDGE HEIGHT IN METRES;;1093/3;3-3;O
