FF-SEQ;FIELD USE DESIGNATOR;;;CLASSNAME;NAME;FLD DESC;FFIRN;STRUCTURE;CARD;
1;ENGINEER CONROL HEADQUARTERS;;;1A;ENGINEER LOCATION TYPE;;1284/15;6-8;M*
2;LOCATION;;;2A;LATITUDE AND LONGITUDE, MINUTES, 0-4 DECIMAL PLACES;;2571;1-22;M*
;LOCATION;;;2B;UNIVERSAL TRANSVERSE MERCATOR (UTM);UTM;2572;;
;LOCATION;;;2C;MILITARY GRID REFERENCE SYSTEM (UTM) (MGRS-UTM);MGRS;2573;;
;LOCATION;;;2D;UNIVERSAL POLAR STEREOGRAPHIC (UPS);UPS;2574;;
;LOCATION;;;2E;MILITARY GRID REFERENCE SYSTEM (UPS) (MGRS-UPS);MUPS;2575;;
;LOCATION;;;2F;NATIONAL GRID SYSTEM COORDINATES;GRID;1911/1;;
