FF-SEQ;FIELD USE DESIGNATOR;;;CLASSNAME;NAME;FLD DESC;FFIRN;STRUCTURE;CARD;
1;ECONOMICAL SPEED IN KNOTS;;;1A;ECONOMICAL SPEED IN KNOTS;;1061/26;1-2;M
2;PERCENTAGE OF FUEL USED IN 24 HOURS AT MOST ECONOMIC SPEED;;;2A;PERCENTAGE OF FUEL USED;;1064/55;1-5;M
3;MAXIMUM SPEED IN KNOTS;;;3A;MAXIMUM SPEED IN KNOTS;;1061/6;1-2;M
4;PERCENTAGE OF FUEL USED IN 24 HOURS AT MAX SPEED;;;4A;PERCENTAGE OF FUEL USED;;1064/55;1-5;M
5;MINIMUM PERCENTAGE OF FUEL ACCEPTABLE;;;5A;MINIMUM ACCEPTABLE PERCENTAGE OF REMAINING FUEL;;1064/57;1-2;M
