FF-SEQ;FIELD USE DESIGNATOR;;;CLASSNAME;NAME;FLD DESC;FFIRN;STRUCTURE;CARD;
1;MNLC AIR INSTRUCTION TYPE;;;1A;MNLC AIR INSTRUCTION TYPE;;1902/2;3-7;M
2;NUMBER OF AIRCRAFT ALLOCATED;;;2A;NUMBER OF AIRCRAFT ALLOCATED;;1044/154;1-3;M*
3;AIRCRAFT CODE;;;3A;AIRCRAFT CODE;;1015/2;2-6;M*
4;BASE LOCATION OF AIRCRAFT;;;4A;BASE NAME;BASE;1022/104;1-38;M*
;BASE LOCATION OF AIRCRAFT;;;4B;SHIP NAME;SHIP;1022/49;;
;BASE LOCATION OF AIRCRAFT;;;4C;ICAO BASE CODE;ICAO;1125/2;;
5;FLIGHT MISSION DESCRIPTION;;;5A;FLIGHT MISSION DESCRIPTION;;1363/69;1-30;M*
