FF-SEQ;FIELD USE DESIGNATOR;;;CLASSNAME;NAME;FLD DESC;FFIRN;STRUCTURE;CARD;
1;MINE OPERATION DIRECTIVE;;;1A;MINE OPERATION DIRECTIVE;;1133/2;5-7;M
2;ENEMY THREAT;;;2A;ENEMY THREAT;;1209/1;3-4;M
3;MINE COUNTERMEASURES OPERATION STANDARD LETTER SUFFIXES;;;3A;MINE COUNTERMEASURES OPERATION STANDARD LETTER SUFFIXES;;1598/1;4-15;M*
4;MCM OPERATION STAGE FIRST NUMBER;;;4A;MCM OPERATION STAGE FIRST NUMBER;;1012/182;2-3;O*
5;MCM OPERATION STAGE SECOND NUMBER;;;5A;MCM OPERATION STAGE SECOND NUMBER;;1012/206;2-3;O*
