FF-SEQ;FIELD USE DESIGNATOR;;;CLASSNAME;NAME;FLD DESC;FFIRN;STRUCTURE;CARD;
1;REAR LINK BASE NAME OR UNIT;;;1A;BASE NAME;BASE;1022/104;1-30;M
;REAR LINK BASE NAME OR UNIT;;;1B;UNIT;;1022/57;;
2;UNIT;;;2A;UNIT;;1022/57;1-30;M*
3;MARITIME REAR LINK DESIGNATOR;;;3A;MARITIME REAR LINK DESIGNATOR;;1305/3;1-3;M*
4;CRYPTO KEYING MATERIAL;;;4A;CRYPTO KEYING MATERIAL;;1078/4;6-15;M*
5;DAY-TIME AND MONTH OF START;;;5A;DAY-TIME AND MONTH OF START;;2030;10-10;M*
6;DAY-TIME AND MONTH OF STOP;;;6A;DAY-TIME AND MONTH OF STOP;;2030;10-10;M*
