FF-SEQ;FIELD USE DESIGNATOR;;;CLASSNAME;NAME;FLD DESC;FFIRN;STRUCTURE;CARD;
1;UNIT MISSION SPECIALITY;;;1A;UNIT MISSION SPECIALITY;;1307/2;1-3;M
2;QUANTITY ON HAND;;;2A;QUANTITY ON HAND;;1044/110;1-6;M
3;QUANTITY ON HAND VALIDITY;;;3A;QUANTITY ON HAND VALIDITY;;1266/5;1-1;M
4;QUANTITY AUTHORISED IN PEACETIME;;;4A;QUANTITY AUTHORISED IN PEACETIME;;1044/377;1-6;O
5;QUANTITY PEACE AUTHORISED VALIDITY;;;5A;QUANTITY PEACE AUTHORISED VALIDITY;;1266/6;1-1;O
6;QUANTITY AUTHORISED IN WARTIME;;;6A;QUANTITY AUTHORISED IN WARTIME;;1044/378;1-6;O
7;QUANTITY WAR AUTHORISED VALIDITY;;;7A;QUANTITY WAR AUTHORISED VALIDITY;;1266/7;1-1;O
8;REMARKS;;;8A;REMARKS;;1357/28;1-68;O
